{
  "meta": {
    "id": "2026-08-24-pipeline-test",
    "title": "렌더링 테스트 — 8개 항목 조판 확인",
    "subtitle": "실제 콘텐츠가 아닙니다. 한글 폰트·여백·규격 검증용 더미 데이터입니다.",
    "category": "생활꿀팁",
    "format": "hybrid",
    "publish_date": "2026-08-24",
    "keywords": [
      "테스트"
    ],
    "axis": {
      "type": "소득구간",
      "buckets": [
        "2천만원 이하",
        "2~4천만원",
        "4~7천만원",
        "7천만원 초과"
      ]
    },
    "gateway": false,
    "dday": "신청 마감 D-14"
  },
  "hook": "이건 발행용이 아닙니다",
  "summary": "포스터 1장과 카드 10장, 9:16 영상이 같은 data.json에서 나오는지 확인합니다.",
  "items": [
    {
      "rank": 1,
      "label": "가장 긴 라벨 길이 확인용 항목",
      "value": "1,200만원",
      "detail": "라벨이 길어졌을 때 자동 폰트 축소가 동작하는지 확인합니다.",
      "source_id": "S001",
      "caption": "자막은 화면과 다른 문장 1 — 무음 시청자에게 정보량 2배"
    },
    {
      "rank": 2,
      "label": "짧은 항목",
      "value": "3개월",
      "detail": "짧은 라벨에서 여백이 어색해지지 않는지 확인합니다.",
      "source_id": "S001",
      "caption": "자막은 화면과 다른 문장 2 — 무음 시청자에게 정보량 2배"
    },
    {
      "rank": 3,
      "label": "숫자 정렬 확인",
      "value": "85.4%",
      "detail": "우측 정렬된 값이 세로로 흐트러지지 않는지 봅니다.",
      "source_id": "S002",
      "caption": "자막은 화면과 다른 문장 3 — 무음 시청자에게 정보량 2배"
    },
    {
      "rank": 4,
      "label": "괄호 포함 (조건부)",
      "value": "최대 5회",
      "detail": "괄호와 특수문자가 줄바꿈을 깨뜨리지 않는지 확인합니다.",
      "source_id": "S002",
      "caption": "자막은 화면과 다른 문장 4 — 무음 시청자에게 정보량 2배"
    },
    {
      "rank": 5,
      "label": "영문 혼용 CPI 지수",
      "value": "104.2p",
      "detail": "한글과 영문이 섞였을 때 자간이 자연스러운지 확인합니다.",
      "source_id": "S002",
      "caption": "자막은 화면과 다른 문장 5 — 무음 시청자에게 정보량 2배"
    },
    {
      "rank": 6,
      "label": "여섯 번째 항목",
      "value": "24만원",
      "detail": "6개 이상일 때 행 높이 압축 분기가 동작하는지 봅니다.",
      "source_id": "S001",
      "caption": "자막은 화면과 다른 문장 6 — 무음 시청자에게 정보량 2배"
    },
    {
      "rank": 7,
      "label": "일곱 번째 항목",
      "value": "1일",
      "detail": "카운트다운 영상에서 하위부터 올라오는지 확인합니다.",
      "source_id": "S002",
      "caption": "자막은 화면과 다른 문장 7 — 무음 시청자에게 정보량 2배"
    },
    {
      "rank": 8,
      "label": "여덟 번째 항목",
      "value": "무제한",
      "detail": "마지막 요약 표에 8행이 모두 들어가는지 확인합니다.",
      "source_id": "S001",
      "caption": "자막은 화면과 다른 문장 8 — 무음 시청자에게 정보량 2배"
    }
  ],
  "sources": [
    {
      "id": "S001",
      "title": "더미 출처 1",
      "issuer": "테스트기관",
      "url": "https://example.go.kr/1",
      "tier": 1,
      "effective_date": "2026-01-01",
      "verified_at": "2026-08-24"
    },
    {
      "id": "S002",
      "title": "더미 출처 2",
      "issuer": "테스트공단",
      "url": "https://example.go.kr/2",
      "tier": 2,
      "effective_date": "2023-03-01",
      "verified_at": "2026-08-24"
    }
  ],
  "cta": "저장해두세요",
  "disclaimer_key": "none"
}